{
  "source_schema_version": "1.0",
  "source_date": "2026-08-07",
  "generated_at": "2026-08-07T08:46:43.164753Z",
  "git_sha": "unknown",
  "environment": {
    "env_id": "remote-p100",
    "host": "wE6lDe",
    "cpu": "x86_64",
    "gpu": "Tesla P100-SXM2-16GB",
    "python": "3.9.16",
    "packages": {
      "statgpu": "0.2.4",
      "numpy": "1.24.2",
      "scipy": "1.10.1",
      "scikit-learn": "1.2.2",
      "cupy": null,
      "torch": "2.0.0"
    },
    "available_backends": [
      "numpy",
      "cupy",
      "torch"
    ]
  },
  "protocol": {
    "seeds": [
      20260807
    ],
    "warmup": 1,
    "repeats": 3,
    "dtype": "float64",
    "synchronization": "backend synchronize immediately before and after each observed timing region",
    "timing_scope": "host-orchestrated public fit with directly observed CV selector and final full-data refit",
    "transfer_policy": "input conversion occurs before timed public fit; device-resident timing",
    "failure_policy": "retain_explicit_disposition"
  },
  "cases": [
    {
      "case_id": "cv-ridgecv",
      "model_id": "RidgeCV",
      "task": "regression",
      "dataset": {
        "generator": "statgpu-cv-regression-v1",
        "n_samples": 240,
        "n_features": 16,
        "n_test_samples": 80,
        "parameters": {
          "seeds": [
            20260807,
            20260807,
            20260807
          ],
          "signal_features": 5
        }
      },
      "cv": {
        "fold_count": 3,
        "split_strategy": "statgpu-deterministic-kfold",
        "shuffle": true,
        "subject_preserving": false
      },
      "grid": {
        "candidate_count": 3,
        "identity": "explicit-candidate-grid-v1",
        "parameters": {
          "alphas": [
            1.0,
            0.1,
            0.01
          ],
          "penalty": "l2"
        }
      },
      "scoring": {
        "name": "mean_squared_error",
        "direction": "minimize",
        "normalization": "per-validation-observation"
      },
      "runs": [
        {
          "framework": "statgpu",
          "backend": "numpy",
          "device": "cpu",
          "status": "success",
          "reason": null,
          "timing": {
            "cv_evaluation_ms": 4.670381546020508,
            "final_refit_ms": 0.6518363952636719,
            "total_fit_ms": 9.062319993972778,
            "peak_memory_bytes": null
          },
          "selected_parameters": {
            "alpha": 0.01
          },
          "scores": {
            "validation_score": 0.3042452317440152,
            "final_score": 0.2526879274997583
          },
          "convergence": {
            "candidate_count": 3,
            "fold_count": 3,
            "failed_candidates": 0,
            "failed_folds": 0,
            "final_refit_converged": true,
            "n_iter": 1
          },
          "repeat_samples": [
            {
              "seed": 20260807,
              "cv_evaluation_ms": 4.662901163101196,
              "final_refit_ms": 0.6608366966247559,
              "total_fit_ms": 9.062319993972778
            },
            {
              "seed": 20260807,
              "cv_evaluation_ms": 4.727214574813843,
              "final_refit_ms": 0.6469190120697021,
              "total_fit_ms": 9.086638689041138
            },
            {
              "seed": 20260807,
              "cv_evaluation_ms": 4.670381546020508,
              "final_refit_ms": 0.6518363952636719,
              "total_fit_ms": 9.062081575393677
            }
          ]
        },
        {
          "framework": "statgpu",
          "backend": "cupy",
          "device": "cuda",
          "status": "success",
          "reason": null,
          "timing": {
            "cv_evaluation_ms": 9.77104902267456,
            "final_refit_ms": 3.364443778991699,
            "total_fit_ms": 17.41701364517212,
            "peak_memory_bytes": null
          },
          "selected_parameters": {
            "alpha": 0.01
          },
          "scores": {
            "validation_score": 0.30424508452415466,
            "final_score": 0.25268792749975866
          },
          "convergence": {
            "candidate_count": 3,
            "fold_count": 3,
            "failed_candidates": 0,
            "failed_folds": 0,
            "final_refit_converged": true,
            "n_iter": 1
          },
          "repeat_samples": [
            {
              "seed": 20260807,
              "cv_evaluation_ms": 9.93528962135315,
              "final_refit_ms": 3.391265869140625,
              "total_fit_ms": 17.611205577850342
            },
            {
              "seed": 20260807,
              "cv_evaluation_ms": 9.77104902267456,
              "final_refit_ms": 3.364443778991699,
              "total_fit_ms": 17.41701364517212
            },
            {
              "seed": 20260807,
              "cv_evaluation_ms": 9.74571704864502,
              "final_refit_ms": 3.338426351547241,
              "total_fit_ms": 17.355382442474365
            }
          ]
        },
        {
          "framework": "statgpu",
          "backend": "torch",
          "device": "torch",
          "status": "success",
          "reason": null,
          "timing": {
            "cv_evaluation_ms": 5.6213438510894775,
            "final_refit_ms": 2.697974443435669,
            "total_fit_ms": 12.491881847381592,
            "peak_memory_bytes": null
          },
          "selected_parameters": {
            "alpha": 0.01
          },
          "scores": {
            "validation_score": 0.30424535274505615,
            "final_score": 0.25268792749975866
          },
          "convergence": {
            "candidate_count": 3,
            "fold_count": 3,
            "failed_candidates": 0,
            "failed_folds": 0,
            "final_refit_converged": true,
            "n_iter": 1
          },
          "repeat_samples": [
            {
              "seed": 20260807,
              "cv_evaluation_ms": 5.762159824371338,
              "final_refit_ms": 2.697974443435669,
              "total_fit_ms": 12.69388198852539
            },
            {
              "seed": 20260807,
              "cv_evaluation_ms": 5.616128444671631,
              "final_refit_ms": 2.726227045059204,
              "total_fit_ms": 12.491881847381592
            },
            {
              "seed": 20260807,
              "cv_evaluation_ms": 5.6213438510894775,
              "final_refit_ms": 2.6781857013702393,
              "total_fit_ms": 12.459933757781982
            }
          ]
        },
        {
          "framework": "sklearn",
          "backend": null,
          "device": "cpu",
          "status": "success",
          "reason": null,
          "timing": {
            "cv_evaluation_ms": 6.553083658218384,
            "final_refit_ms": 0.5994439125061035,
            "total_fit_ms": 7.204592227935791,
            "peak_memory_bytes": null
          },
          "selected_parameters": {
            "alpha": 0.01
          },
          "scores": {
            "validation_score": 0.30424523174401524,
            "final_score": 0.2526879274997587
          },
          "convergence": {
            "candidate_count": 3,
            "fold_count": 3,
            "failed_candidates": 0,
            "failed_folds": 0,
            "final_refit_converged": true,
            "n_iter": 0
          },
          "repeat_samples": [
            {
              "seed": 20260807,
              "cv_evaluation_ms": 6.619870662689209,
              "final_refit_ms": 0.5848705768585205,
              "total_fit_ms": 7.226705551147461
            },
            {
              "seed": 20260807,
              "cv_evaluation_ms": 6.523936986923218,
              "final_refit_ms": 0.5994439125061035,
              "total_fit_ms": 7.1443915367126465
            },
            {
              "seed": 20260807,
              "cv_evaluation_ms": 6.553083658218384,
              "final_refit_ms": 0.6195306777954102,
              "total_fit_ms": 7.204592227935791
            }
          ]
        }
      ]
    },
    {
      "case_id": "cv-lassocv",
      "model_id": "LassoCV",
      "task": "regression",
      "dataset": {
        "generator": "statgpu-cv-regression-v1",
        "n_samples": 240,
        "n_features": 16,
        "n_test_samples": 80,
        "parameters": {
          "seeds": [
            20260807,
            20260807,
            20260807
          ],
          "signal_features": 5
        }
      },
      "cv": {
        "fold_count": 3,
        "split_strategy": "statgpu-deterministic-kfold",
        "shuffle": true,
        "subject_preserving": false
      },
      "grid": {
        "candidate_count": 3,
        "identity": "explicit-candidate-grid-v1",
        "parameters": {
          "alphas": [
            1.0,
            0.1,
            0.01
          ],
          "penalty": "l1"
        }
      },
      "scoring": {
        "name": "mean_squared_error",
        "direction": "minimize",
        "normalization": "per-validation-observation"
      },
      "runs": [
        {
          "framework": "statgpu",
          "backend": "numpy",
          "device": "cpu",
          "status": "success",
          "reason": null,
          "timing": {
            "cv_evaluation_ms": 20.912975072860718,
            "final_refit_ms": 3.9431750774383545,
            "total_fit_ms": 29.17364239692688,
            "peak_memory_bytes": null
          },
          "selected_parameters": {
            "alpha": 0.01
          },
          "scores": {
            "validation_score": 0.29281777940827264,
            "final_score": 0.24399218595909514
          },
          "convergence": {
            "candidate_count": 3,
            "fold_count": 3,
            "failed_candidates": 0,
            "failed_folds": 0,
            "final_refit_converged": true,
            "n_iter": 22
          },
          "repeat_samples": [